{
  "schemaVersion": "4.0.0",
  "recordType": "position_evidence",
  "recordId": "position-example",
  "createdAt": "2026-07-24T00:00:00Z",
  "status": "BLOCKED",
  "provenance": {},
  "canonicalPlayerId": null,
  "scope": {},
  "officialStartingPositions": [],
  "lineupRoleMinutes": [],
  "averagePositions": [],
  "eventZoneProfiles": [],
  "heatmapRefs": [],
  "classification": {}
}
